id,date,match_date,competition,match,type,market,selection,odds,stake,model_prob,fair_odds,edge,status,result,points,pnl,rationale,created_at,settled_at
2026-06-11-kicktipp-meksyk-vs-rpa-exact-score,2026-06-11,2026-06-11,WC2026,Meksyk vs RPA,kicktipp,exact_score,1:0,,,0.18,5.556,,pending,,,,"Gospodarz-faworyt (~67% de-vig), mocna defensywa Meksyku + niski O/U i wysokosc n.p.m.; 1:0 maks. oczek. pkt (~1.6)",2026-06-11T15:11:16,
2026-06-11-kicktipp-korea-pld-vs-czechy-exact-score,2026-06-11,2026-06-11,WC2026,Korea Pld vs Czechy,kicktipp,exact_score,1:0,,,0.11,9.091,,pending,,,,"Wyrownany mecz, lekka przewaga Korei (Son, Lee Kang-in); 1:0 ~ oczek. pkt maks., 2:1 niemal rownowazne",2026-06-11T15:11:16,
2026-06-11-sts-meksyk-vs-rpa-ou25,2026-06-11,2026-06-11,WC2026,Meksyk vs RPA,sts,ou25,Ponizej 2.5,1.65,10,0.65,1.538,0.073,pending,,,,Szac. ~2.1 gola lacznie; Under ~65% vs kurs ~60%. WARUNEK: potwierdz kurs >=1.62 na STS. Stawka 0.5u,2026-06-11T15:11:16,
2026-06-12-kicktipp-kanada-vs-bo-nia-i-hercegowina-exact-score,2026-06-11,2026-06-12,WC2026,Kanada vs Bośnia i Hercegowina,kicktipp,exact_score,1:0,,,0.162,6.173,0.0,pending,,,,"Kanada faworytem w domu (BMO Field Toronto), ale bez Alphonso Daviesa. Lambda_K=1.2, lambda_B=0.8 (szac.); Poisson: najwyższe E(pkt)≈1.35 dla 1:0 wg 9-tki. Bosnia BTTS active ale defensive tournament approach likely.",2026-06-11T15:47:58,
2026-06-12-kicktipp-usa-vs-paragwaj-exact-score,2026-06-11,2026-06-12,WC2026,USA vs Paragwaj,kicktipp,exact_score,1:0,,,0.144,6.944,0.0,pending,,,,"USA minimalny faworyt u siebie (SoFi Stadium LA). Lambda_U=1.3, lambda_P=0.9 (szac.); Poisson E(pkt)≈1.37 dla 1:0. Paragwaj defensywny, mały wynik likely.",2026-06-11T15:47:58,
2026-06-12-sts-kanada-vs-bo-nia-i-hercegowina-ou25,2026-06-11,2026-06-12,WC2026,Kanada vs Bośnia i Hercegowina,sts,ou25,Poniżej 2.5,1.7,10.0,0.675,1.48,0.148,pending,,,,"Davies OUT (kluczowy gracz Kanady). Szac. lambda_K=1.2, lambda_B=0.8, P(U2.5)≈67.5%. Market Under -144 (1.69 US). STS szac. 1.70. Edge szac. ~14.8%. UWAGA: zweryfikuj kurs na STS przed wejściem.",2026-06-11T15:48:08,
2026-06-12-sts-usa-vs-paragwaj-ou25,2026-06-11,2026-06-12,WC2026,USA vs Paragwaj,sts,ou25,Poniżej 2.5,1.78,10.0,0.624,1.6,0.111,pending,,,,"Paragwaj bardzo defensywny; ostatnie 4 mecze konkurencyjne <3 goli. Szac. lambda_U=1.3, lambda_P=0.9, P(U2.5)≈62.4%. Edge szac. ~11%. Mecz o 03:00 PL — zaplanuj z wyprzedzeniem lub pomiń, jeśli nie chcesz grać w środku nocy.",2026-06-11T15:48:09,
